"component","bagofwords","transformed_bagofwords"
"com.amaze.filemanager.filesystem.ssh.SshClientUtils","Execute given Client Template This template pattern borrowed from Spring Framework simplify code operations using Sftp param link execute Type return value execution results public static final Null client null retval Connection Pool Instance else throw Runtime Exception Unable catch Error executing method finally close Finish Disconnect with Session false Override session start Open closing SFTP sftp Convenience call Util Encrypted Path Context String contains password assuming encrypted full exists Necessary Without Protocol substring PREFIX length last Index Config General Security encrypting path Decrypted decrypted decrypting extract Base example user home this returns Full remote part From index Remote Disconnects wrap exceptions beneath callers free hassles handling thrown instance void Connected disconnect connection launch Hybrid File Parcelable base Main Activity activity derive hostname port username Pair selected Parsed format ","hassl user spring client free handl remot static disconnect instanc catch main code protocol except abl runtim hybrid exist pattern port start substr secur error use deriv assum framework finish caller void null format para templat borrow conveni pars final type exampl result simplifi contain return call home file valu base wrap select connect fals launch execut session prefix unabl length pair context method thrown activ string link con overrid password extract util throw fig retriev path pool els host thi beneath name decrypt close oper encrypt parcel index public"
"com.amaze.filemanager.filesystem.ssh.Statvfs","Convenience method creating code statvfs openssh link Request param sftp Client SFTP instance path remote return public static final request String Engine Packet Type EXTENDED STATVFS OPENSSH Subsystem Remote Charset ","staff method client string link remot request engin static creat instanc set para char ssh code conveni path subsystem final type extend return packet public"
"com.amaze.filemanager.filesystem.ssh.CustomSshJConfig","public static void init Security remove Provider insert spongycastle provider Bouncy Castle Providers length bouncycastle ","length remov castl spongi provid static insert public secur intu void bounci"
"com.amaze.filemanager.filesystem.ssh.SshClientTemplate","Constructor with close Client Finish true that connection must after code execute param form username password host port public Template Null String this false will kept finishes This useful other calls reuse boolean Implement logic here client link instance opened authenticated Requested return type Result execution requested abstract throws Exception ","user use implement client string link request finish password instanc throw constructor null para boolean templat code kept except type host thi logic true result name connect fals port close authent execut reus return abstract call form public"
"com.amaze.filemanager.filesystem.ssh.SshConnectionPool","this obtain Connection Pool instance singleton return link public static final Instance null Obtain Client connection from underlying pool Beneath will exists otherwise create into param form code username password host port already opened authenticated throws Exception Exceptions that occur during setup Null String Utils extract Base From client connections else validate longer usable Reconnecting expire remove Different above accepts broken down parameters convenience method setting SFTP required server Fingerprint expected fingerprint using Pair based authentication Nullable derive Sftp Path Kill still place Used amaze filemanager activities Main Activity Destroy exit void expunge Connections ","expir pair user accept setup use method client deriv activ string link usabl exit singleton server password static creat util extract void instanc manag set file throw null requir obtain para reconnect broken main code conveni fingerprint except paramet expung path abl pool occur destroy final els host thi exist kill base underli valid beneath otherwis name amaz connect port remov authent return form public expect"
"com.amaze.filemanager.filesystem.ssh.test.BlockFileCreationFileSystemProvider","Read only param path options attrs return throws Exception Override public File Channel Path extends Open Option Attribute unroot System Provider provider Collections singleton Standard READ Output Stream Unsupported operation ","attar stream overrid singleton collect file throw para system except path option standard channel provid output attribut unsupport extend oper read return public uproot"
"com.amaze.filemanager.filesystem.ssh.test.TestKeyProvider","public Test Provider throws Exception Pair Generator Instance initialize Secure Random generate Override Iterable load Keys return Collections singleton ","instanc pair inalter singleton gener throw random test collect load return overrid key except initi public secur provid"
"com.amaze.filemanager.filesystem.compressed.TestArchives","public static void init Context context String type ARCHIVE TYPES read Archive byte throws Exception return Utils Byte Array class Loader Resource Stream test archive ","archiv array resourc type context throw read test loader string cla stream return static except byte public util intu void"
"com.amaze.filemanager.filesystem.compressed.CompressedHelperTest","Before public void context Runtime Environment application empty Update Listener Extractor Override Start long total Bytes String first Entry Name entry Path Finish boolean Cancelled return false check This program extension extractor Check each extensions matched correct Test Instance File file test result Compressed Helper assert Equals Class class Gzip Null Decompressor decompressor Compressor Extractable fuction throws Exception True False function name invalid compressed with ","correct match updat compress extens context helper string listen extractor overrid finish program extract void environ instanc entri file throw null test function boolean equal compressor except check path runtim empti total thi true result cancel name fals start zip cla assert return fiction byte public decompress applic invalid"
"com.amaze.filemanager.filesystem.compressed.B0rkenZipTest","Override public void Start long total Bytes String first Entry Name Update entry Path Finish boolean Cancelled return false Before throws Exception Utils copy Class Loader Resource Stream slip File Output zipfile test slashprefix Test Extract With Wrong Unix Extractor extractor Runtime Environment application Absolute External Storage Directory empty Listener Everything assert Equals Invalid Archive Entries size True good exists Windows Slash Prefix Files Helper Task Should Omit Backslash ","window updat helper string stream wrong extern extractor directori overrid listen finish extract slip util omit void environ archiv entri file throw test boolean equal copi except path runtim empti task absolut size total loader exist true cancel name slash fals resourc output storag start backslash zip cla assert return byte public invalid applic prefix"
"com.amaze.filemanager.filesystem.compressed.CompressedHelper","compatibility with other compressed file types edit this method public static Extractor Instance Context context File String output Path Update listener extractor Extension else Gzipped return null Decompressor Compressor decompressor boolean Extractable path Gets name without compression extention example Name Lower Case substring last Index Utils Last Char final Entry Valid entry starts With equals ","updat compress extens context method string listen extractor compat edit static extract util instanc file entri null char boolean equal compressor substr path els type final thi exampl valid name lower output start zip return index public decompress"
"com.amaze.filemanager.filesystem.compressed.extractcontents.AbstractExtractorTest","Before public void throws Exception Shadow Environment External Storage State MEDIA MOUNTED Test Archives init Runtime application copy After tear Down test Entry Name Extractor extractor Class Constructor Context class String Update Instance File Absolute Path Directory null assert Equals Files Count Latch latch Override Start long total Bytes first entry Finish count verify Extracted Contents catch print Stack Trace fail Error verifying extracted archive contents boolean Cancelled return false Everything await ","error updat tear context medium trace string extern directori extractor fail overrid finish extract latch void environ archiv instanc entri file catch throw constructor null test count mount equal boolean copi except print intu path runtim absolut total verifi cancel name fals await storag start byte cla assert content return stack shadow public applic"
"com.amaze.filemanager.filesystem.compressed.extractcontents.TarExtractorTest","",""
"com.amaze.filemanager.filesystem.compressed.extractcontents.RarExtractorTest","",""
"com.amaze.filemanager.filesystem.compressed.extractcontents.TarGzExtractorTest","",""
"com.amaze.filemanager.filesystem.compressed.extractcontents.ZipExtractorTest","",""
"com.amaze.filemanager.filesystem.compressed.extractcontents.ExtractorTestSuite","",""
"com.amaze.filemanager.filesystem.compressed.extractcontents.Extractor","public Extractor Context context String file Path output Update listener this invalid Archive Entries Array List void extract Files files throws Exception Everything Invalid return ","output archiv array updat file entri context throw thi string return listen extractor list except public invalid path void extract"
"com.amaze.filemanager.ui.ColorCircleDrawable","public Color Circle Drawable final color this Paint ANTI ALIAS FLAG Style FILL Override void draw Canvas canvas Rect bounds Bounds center Radius Alpha alpha Filter Opacity return Pixel Format TRANSLUCENT ","canva paint color overrid draw fill void style alia format opac filter antu alpha bound drawabl final thi cert flag center transluc radiu circl return pixel public"
"com.amaze.filemanager.ui.ItemPopupMenu","public Item Popup Menu Context Main Activity Utilities Provider Fragment main Layout Element Parcelable View anchor Shared Preferences shared super context utilities this Prefs accent Color Accent Click Listener Override boolean item switch case about General Dialog Creation show Properties With Permissions generate Base File permissions Themed Root Explorer return true Mode DROPBOX GDRIVE ONEDRIVE Utils Cloud desc break default Array array Files rename Paste Helper OPERATION COPY paste Hybrid extract book Data data Instance Book String title Drawer refresh Toast make Text string bookmarksadded LENGTH LONG delete positions Elements open with Stack Boolean Constants PREFERENCE TEXTEDITOR NEWSTACK false encrypt final Intent Encrypt Service class Extra OPEN MODE ordinal SOURCE preferences Manager Default Decrypt Button Callback Interface Authenticate void Pressed intent password throws Security Exception start Encryption Path CRYPT MASTER PASSWORD DEFAULT equals Preset Password Save ENCRYPT else FINGERPRINT WARNING REMEMBER catch print Trace encryption fail Warning decrypt Parent select Results ","break trace color editor instanc catch switch equal anchor main past copi except master abl crypt pop rememb hybrid intent posit default item start bookmark preset cla secur helper explor void parent manag drive layout fingerprint pref accent final ordin result delet properti authent share return interfac renam fragment book press view menu fail click dialog file refresh warn print sourc prefer creation base select element theme fals provid array root super box button length context activ string datum constant listen callback overrid password extract util extra gener throw disc boolean titl path els drop save thi drawer true permiss mode cloud decrypt oper toast servic encrypt stack parcel text public"
"com.amaze.filemanager.ui.colors.ColorUtils","public static void colorize Icons Context context icon Type Gradient Drawable background Color default switch case VIDEO IMAGE Utils video item break AUDIO audio CODE code TEXT COMPRESSED archive KNOWN generic ","compress context break color static util void imag archiv gradient gener switch code drawabl type video icon background audio default item text public"
"com.amaze.filemanager.ui.colors.ColorPreference","",""
"com.amaze.filemanager.ui.colors.ColorPreferenceHelper","Randomizes does save colors used interface return link Color Preference object itself public static User Preferences randomize Context RANDOM COMBINATIONS next length Utils Eases retrieval primary Usage index bounds first returned default param given Primary current Colors Second First Current context Shared prefs null void user Prefs Editor editor Constants PREFERENCE SKIN ACCENT accent ICON icon Skin apply ","length object random user context combin link constant color eas editor skin static util void null para retriev usag current primari pref appli bound accent prefer save icon default share return index public interfac"
"com.amaze.filemanager.ui.colors.UserColorPreferences","public User Color Preferences primary First Second accent icon Skin this Override void write Parcel dest flags describe Contents return create From Array size ","array prefer user write size fest void primari thi flag icon describ color content return overrid parcel skin public creat accent"
"com.amaze.filemanager.ui.icons.MimeTypes","Mime Type file param path which mime type return form String public static boolean Directory null MIME TYPES final extension Extension Empty Lower Case Locale Default Singleton From Match input Pattern matches replace Helper method link calculate last files extracted from name lowercase contains substring Index else ","match extens method helper string link directori singleton static extract mime file null para boolean calcul path empti final type els lower name default pattern replac contain lowercas return local input form index public substr"
"com.amaze.filemanager.ui.icons.Icons","public static Drawable load Mime Icon String path boolean Directory equals return drawable arrow left white Compressed Helper File Extractable compressed type Type switch case AUDIO audio IMAGE image TEXT text VIDEO video CERTIFICATE certificate CODE codes FONT font ENCRYPTED folder lock default grid else generic mime Types null KNOWN Integer check crypt ","folder compress helper string left lock directori static extract arrow imag mime file gener null switch boolean equal certif code check path drawabl crypt els type font video icon integ audio default white grid encrypt load return text public"
"com.amaze.filemanager.ui.dialogs.RenameBookmark","public static Rename Bookmark Instance String path accent Color rename Bundle bundle title Arguments return Override void Create saved State super Dialog ","instanc dialog bundl save void bookmark string color titl static argument return overrid super public creat path accent renam"
"com.amaze.filemanager.ui.dialogs.SmbConnectDialog","Override public void Create Bundle saved Instance State super utils Provider Basic Activity Utils Dialog ","instanc dialog basic save activ provid super overrid public creat util void bundl"
"com.amaze.filemanager.ui.dialogs.SftpConnectDialog","Override public void Create Bundle saved Instance State super utils Provider Config Utils Handler Dialog authentication when Intent browse file returned Activity Result request Code result data ","activ datum con request overrid creat util void instanc dialog file fig brows code bundl handler save intent result provid authent super return public"
"com.amaze.filemanager.ui.dialogs.ColorPickerDialog","public Color Picker Dialog Context context Attribute attrs super Layout Resource layout dialog colorpicker Positive Button Text android string Negative cancel Icon null void Preference Helper User Preferences Theme theme this Listener Accepted Config listener Override Char Sequence Summary return Bind View view shared Prefs Shared accent selected Index DATA boolean Using Default Constants PREFERENCE COLOR CONFIG SKIN primary indigo ACCENT pink ICON edit DEFAULT apply Boolean random checkbox false RANDOM INDEX remove CUSTOM Linear container find COLORS length child inflate Item true first Circular Colors colors circular Material LIGHT Divider WHITE else BLACK custom Visibility INVISIBLE ","length inflat user accept context use random helper view string datum child neg color attar listen con constant overrid linear skin edit void dialog divid fig null custom char circular boolean layout primari check pref appli android accent visibl invis prefer indigo els bind sequenc light thi materi icon black picker true posit cancel select default theme fals resourc pink attribut white item remov summari contain share super return box text index public button"
"com.amaze.filemanager.ui.dialogs.GeneralDialogCreation","public static Material Dialog show Basic Themed Activity themed String content title postive Text negative accent Color Accent Builder widget positive return build Name final Main hint prefill Button neutral Single Callback Action Warnable Input Validator Validate validator builder View dialog Layout Inflater inflate layout singleedittext null Edit textfield find input Hint Textfield warnabletextinputlayout custom false Positive Context POSITIVE Utils Empty after Changed Suppress Warnings Constant Conditions void delete Files Array List Element Parcelable Elements main positions Properties With Permissions Hybrid base permissions activity boolean Root true Without Storage Cloud Open Mode open Encrypt Intent intent Fragment Decrypt Interface encrypt Preset Password Save Null password Authenticate Requires Fingerprint decrypt throws General Security Exception Help string instructions doit Package Archive Compress current Sort Shared Preferences shared Apps History Data data Prefs Hidden cancel hiddenfiles auto Dismiss Adapter adapter Concurrent Radix Tree divider GRAY update context Paths prefs Explanation Creation explanation access ","neutral inflat color static divid hint main hidden except abl acc build pap hybrid dismi histori intent chang posit explan preset condit secur action instruct compr materi neg void archiv suppr custom null adapt layout fingerprint pref accent empti final auto valid field cancel delet properti authent content share return interfac fragment singl view widget edit dialog file basic requir sort radix current warn prefer creation help base tree list element theme fals concurr array root input button dot updat context activ string datum constant callback password util compartment throw boolean titl path save refil true permiss mode name cloud decrypt builder gray storag encrypt packag parcel text public singletre"
"com.amaze.filemanager.ui.dialogs.SmbSearchDialog","Override public void Create Bundle bundle super utils Provider Basic Activity Utils accent Color Themed Accent dismiss subnet Scanner null interrupt Dialog saved Instance State ","instanc interrupt subnet dialog basic theme null save activ dismi provid super color accent scanner overrid public creat util void bundl"
"com.amaze.filemanager.ui.views.appbar.SearchView","public Search View final appbar Main Activity Listener search show view with circular reveal animation void START RADIUS Radius Math Toolbar Width Height Animator animator android Build VERSION CODES LOLLIPOP Coords Item find Edit Text Location Screen Animation Utils create Circular Reveal Layout else Object Float alpha main Smoke Interpolator Accelerate Decelerate Duration Visibility VISIBLE start Override Start request Focus Input Method Manager System Service Context INPUT METHOD SERVICE Soft SHOW IMPLICIT enabled true Cancel Repeat hide GONE false input From Window Token HIDE ONLY boolean Enabled return Shown ","enabl window object gone context soft anim method view activ token height listen request overrid math deceler edit durat creat util void version search lollipop manag circular shown boolean main code layout alpha system smoke screen visibl android acceler tool appear final els focu bar build implicit true locat cancel repeat fals hide item interpol curd text start reveal radiu servic float input return width public"
"com.amaze.filemanager.ui.views.appbar.AppBar","public Main Activity Shared Preferences shared Search View Listener search toolbar find action this bottom Bottom appbar Layout Elevation TOOLBAR START INSET Content Inset Start Boolean Constants PREFERENCE INTELLI HIDE true Params params Scroll Flags Expanded Toolbar return Appbar void Title String title null ","action activ view string constant listen inset void search expand null para boolean titl main layout intellig tool prefer appear bar thi true flag hide elev start share content bottom return scroll public"
"com.amaze.filemanager.ui.views.appbar.BottomBar","public Bottom appbar Main Activity main this frame find View buttonbarframe scroll buttons path Layout pathbar Scroll full Path Text fullpath Anim anim pathname Smooth Scrolling Enabled true Params Linear WRAP CONTENT Group gravity Gravity CENTER VERTICAL Root Image Button Background Color TRANSPARENT Storage Drawable Resources drawable storage white arrow keyboard right timer Count Down Timer Override void Tick long Finish File Utils crossfade Inverse gesture Detector Gesture Application Context Simple Listener boolean Motion Event return Single Confirmed Fragment fragment Frame instanceof Current open Mode Open FILE cancel start show Buttons else Compressed Explorer false Long Press Boolean PREFERENCE CHANGEPATHS results Visibility VISIBLE General Dialog Creation Change Paths Prefs Click Touch reset null String Full Showing final Interface color visibility update Null news query openmode folder file event ","folder cro color reset linear arrow imag buttonhol instanc main touch invers transpar visibl detector chang background confirm center smooth start bottom scroll event keyboard aim tick finish explor void null para layout pref appear final gestur result cancel white simpl content return graviti interfac fragment enabl timer singl view click file dialog count pathnam current prefer creation fade wrap frame fals root pre button updat compress context activ string listen overrid motion util boolean path drawabl els bar vertic thi news true mode resourc queri storag text public applic"
"com.amaze.filemanager.ui.views.drawer.MenuMetadata","public Menu Metadata String path this type ITEM ENTRY Click Listener null INTENT ","type entri item null thi string datum menu metum intent listen click public path"
"com.amaze.filemanager.ui.views.drawer.CustomNavigationView","public Custom Navigation View Context context Attribute attrs super Item Selected Listener this Override void Nullable listener subclass boolean Menu item null should Checked return else true checked deselect Items find Parcelable Save Instance State Saved Missing selected Restore state instanceof Super This hack when unmarshalled Class Found Exception will thrown actual found android support design widget seem only replicate Marshmallow someone replicated through https github Team Amaze File Manager issues issuecomment Trying returning false Name throws doesn work because seems have been loaded with current loader unmarshaller uses course idea what means could wrong crash Build VERSION CODES ","git context thrown cours view menu attar widget listen miss arshal overrid marshmallow marshal wrong subcla hack void version instanc manag mean file throw custom null boolean code reselect support except current check design replic android abl els save build thi loader comment true actual found amaz select name idea fals attribut tri crash item issu navig cla super return restor hub parcel team load public"
"com.amaze.filemanager.ui.views.drawer.ActionViewStateManager","public Action View State Manager Color idle accent Icon selected void deselect Current last Item Selected null Filter Menu item Image Button ","manag action item null idl view void icon menu color current filter reselect select public button accent imag"
