"component","bagofwords","transformed_bagofwords"
"com.amaze.filemanager.activities.TextEditorActivity","Override public void Create Bundle saved Instance State super Theme equals DARK Window Decor View Background Color Utils this color holo dark background else BLACK android black Content layout search Layout find searchview toolbar Support Action primary Preference Helper Primary Current Main Activity current Build VERSION CODES LOLLIPOP Manager Task Description task Amaze Bitmap Drawable Resources mipmap launcher Edit Text Button prev down next close Changed Listener Click boolean Stack Boolean PREFERENCE TEXTEDITOR NEWSTACK Display Home Enabled KITKAT WATCH System Tint tint Status true Frame Margin Params Group texteditor Config config Margins Height colourednavigation COLORED NAVIGATION window Flags FLAG DRAWS SYSTEM BACKGROUNDS clear TRANSLUCENT STATUS Navigation Input fname scroll editscroll final Intent Data null File Editable Abstraction Toast make string file error LENGTH LONG show finish Title Typeface DEFAULT Default Mono MONOSPACE Original String ORIGINAL index INDEX MODIFIED Scroll MONOFONT load Pressed check Unsaved Changes Options Menu menu Inflater inflate return Prepare Item Visible Modified monofont Checked Selected item switch case home break details scheme SCHEME FILE hybrid Parcelable exists General Dialog Creation Properties Without Permissions obtainable info SHORT openwith openunknown false allowed reopen from Shown hide Search reveal default before Char Sequence char hash Code cancel clean Spans Timer purge schedule modified invalidate after editable execute circular animation start Radius Math Width Metrics metrics width Pixels Bottom Animator animator Animation create Circular Reveal Object Float alpha Interpolator Accelerate Decelerate Duration Visibility VISIBLE Adapter request Focus Method Service Context INPUT METHOD SERVICE Soft SHOW IMPLICIT GONE input From Token HIDE ONLY Entry Value nodes LIGHT YELLOW Integer Spanned SPAN INCLUSIVE LTGRAY highlight Line Spacing Extra size ","window inflat soft display mono break color node editor creat instanc line schedul switch equal span main code space visibl bundl abl allow font focu build light hybrid exist intent purg chang background amaz margin default statu hide item start navig load bottom scroll bitmap info hole error dark action gone helper token ray descript reopen math draw finish void search launcher manag null para shown char adapt layout system detail android acceler final decor sequenc black integ flag cancel watch properti content abstract return invalid modifi enabl timer press anim view menu unsav home click durat request edit yellow inclus lollipop origin file dialog circular unknown valu support current alpha primari check option tool prefer task creation size frame select theme fals metric width reveal radiu execut prepar float super input pixel button length object context method activ string datum tint short height listen con overrid deceler highlight util scheme version hash entri extra fig obtain boolean titl circumnavig mishap drawabl els bar save atinka thi implicit true permiss clean resourc close typefac rev transluc interpol toast servic stack parcel text index public fame"
"com.amaze.filemanager.asynchronous.services.ExtractServiceTest","Before public void throws Exception Shadow Environment External Storage State MEDIA MOUNTED Utils copy Class Loader Resource Stream slip File Output zipfile test archive rarfile tarfile tarballfile service Robolectric setup Service Extract class After tear Down Test Slip perform assert Equals Runtime application String string multiple invalid entries Toast Text Latest Normal Null ","setup tear medium string stream extern extract slip util void environ archiv normal file entri throw perform ferroelectr test null mount equal copi except runtim tar multipl loader interfil arbel resourc output storag zip toast servic cla assert text shadow public invalid applic"
"com.amaze.filemanager.asynchronous.services.CopyService","Override public void Create super Application Context register Receiver receiver Intent Filter BROADCAST COPY CANCEL Start Command intent flags final start Bundle Root Explorer Boolean Extra ROOT EXPLORER false Array List Hybrid File Parcelable files SOURCES String target Path TARGET mode OPEN MODE Open Mode UNKNOWN ordinal boolean move MOVE shared Preferences Manager Default Shared accent Color Config Utils Provider Current User this Notify Notification System Service NOTIFICATION SERVICE START notification Main Activity class Action ACTION MAIN Flags FLAG ACTIVITY TASK INTENT PROCESS VIEWER true Pending pending custom Small Content Views Remote Package Name layout service small stop Broadcast UPDATE CURRENT Compat action drawable content copy white string Builder Constants CHANNEL NORMAL Icon Custom Heads Style Decorated Ongoing Metadata TYPE Foreground build init progress Halted Background execute return STICKY Progress Listener Destroy unregister context Handler Cancelled Binder ","unregist user color remot creat stop command move copi main bundl abl notifi build hybrid icon intent pend background default regist start cla target action explor void manag style custom layout system compact accent final decor type metum ordin flag cancel white head ongo share content return halt view receiv viewer file proce unknown filter current intu sourc task prefer notif list channel fals provid array binder root execut super sticki broadcast updat context activ string datum constant listen con overrid foreground util normal extra fig boolean progress path drawabl destroy handler thi true mode name builder servic packag parcel public applic"
"com.amaze.filemanager.asynchronous.services.ZipService","Override public void Create register Receiver receiver Intent Filter COMPRESS BROADCAST CANCEL Start Command intent flags final start String Path Extra PATH Array List Hybrid File Parcelable base Files FILES Notify Manager Notification System Service Context NOTIFICATION SERVICE exists create catch Exception print Stack Trace shared Preferences Default Shared Application accent Color Config Utils Provider Current User this notification Main Activity class INTENT PROCESS VIEWER true Pending pending custom Small Content Views Remote Package Name layout service small stop Broadcast FLAG UPDATE CURRENT Compat Action action drawable grey string Builder Constants CHANNEL NORMAL Icon Custom Heads Style Decorated Ongoing Metadata TYPE Foreground build init super progress Halted async Task Compress Async execute return START STICKY Progress Listener context Handler Cancelled Binder Destroy unregister ","unregist user trace color remot creat stop command rey catch main except abl notifi build hybrid exist icon intent pend sync default regist start cla action compr void manag style custom layout system compact accent final decor type metum flag cancel head ongo share content return halt view receiv viewer file proce filter current print intu task prefer base notif list channel provid array binder execut super sticki broadcast updat context activ string datum constant listen con overrid foreground util normal extra fig progress path drawabl destroy handler thi true name builder servic stack packag parcel public applic"
"com.amaze.filemanager.asynchronous.services.AbstractProgressiveService","Override public Start Command Intent intent flags start return super abstract Progress Listener void progress Halted Notification Custom View Small notification service small true Text text time Remaining String string unknown transfer Rate Manager notify Builder build Resumed Math round Percent false Publish results link Datapoint Parcelable eventually Process Viewer Fragment param speed number bytes being copied Complete whether operation completed ongoing supported moment move files moved final publish Results long boolean Handler Cancelled Name File total Size Total written Written float Title Service Watcher Util state Interaction Interface STATE HALTED Formatter format this filename remaining Time Utils Timer else Constants COPY processing Ongoing Auto Completed Source Files Processed Returns Packages list which contains data transferred Method call synchronized avoid modifying handler Thread while Main Activity Runnable executing callbacks index size Decrypt Initializes views initial Views zero Bytes ","command runnabl move copi main speed abl notifi build intent start synchron math void manag custom format para final complet auto result flag cancel initi zero thread ongo contain return abstract call halt interfac interact modifi fragment timer view time viewer file proce resum unknown remain support round sourc transfer size formatt notif watcher filenam list fals execut float super publish avoid method percent activ string link datum constant listen callback overrid util index moment boolean titl progress eventu handler els written total thi true name decrypt builder rate oper servic process packag parcel text byte public"
"com.amaze.filemanager.asynchronous.services.ExtractService","Override public void Create register Receiver receiver Intent Filter BROADCAST EXTRACT CANCEL context Application Context Start Command intent flags final start Progress Listener return progress this Destroy unregister Handler Cancelled true Binder ","unregist context listen overrid extract creat receiv void command filter progress destroy handler final thi intent true flag cancel regist start binder return public broadcast applic"
"com.amaze.filemanager.asynchronous.services.DecryptService","Override public void Create super context Application Context register Receiver cancel Intent Filter BROADCAST CRYPT CANCEL Start Command intent flags start base File Parcelable Extra SOURCE shared Preferences Manager Default Shared accent Color Config Utils Provider Current User this Open Mode open values OPEN MODE UNKNOWN ordinal notification Notification System Service NOTIFICATION SERVICE Main Activity class Action ACTION MAIN Flags FLAG ACTIVITY TASK INTENT PROCESS VIEWER true Pending pending custom Small Content Views Remote Package Name layout service small stop Broadcast UPDATE CURRENT Compat action drawable folder lock white String string Builder Constants CHANNEL NORMAL Custom Heads Style Decorated Ongoing decrypt Path DECRYPT PATH Icon Metadata TYPE Foreground build init progress Halted Decrypt Background Task execute return START STICKY Progress Listener boolean Binder Destroy unregister Handler Cancelled ","folder unregist user color remot creat stop command main abl crypt build icon intent pend background default regist start cla action void manag style custom layout system compact accent decor type metum ordin flag cancel white head ongo share content return halt view lock receiv viewer file proce valu unknown filter current intu sourc task prefer base notif channel provid binder execut super sticki broadcast updat context activ string datum constant listen con overrid foreground util normal extra fig boolean progress path drawabl destroy handler thi true mode name decrypt builder servic packag parcel public applic"
"com.amaze.filemanager.asynchronous.services.EncryptService","Override public void Create super context Application Context register Receiver cancel Intent Filter BROADCAST CRYPT CANCEL Start Command intent flags start base File Parcelable Extra SOURCE target Filename String ENCRYPT TARGET shared Preferences Manager Default Shared accent Color Config Utils Provider Current User this Open Mode open values OPEN MODE UNKNOWN ordinal notification Notification System Service NOTIFICATION SERVICE Main Activity class Action ACTION MAIN Flags FLAG ACTIVITY TASK INTENT PROCESS VIEWER true Pending pending custom Small Content Views Remote Package Name layout service small stop Broadcast UPDATE CURRENT Compat action drawable folder lock white string Builder Constants CHANNEL NORMAL Custom Heads Style Decorated Ongoing Icon Metadata TYPE Foreground build init progress Halted Background Task execute return START STICKY Progress Listener Binder Destroy unregister Handler Cancelled ","folder unregist user color remot creat stop command main abl crypt build icon pend intent background default regist start cla target action void manag style custom layout system compact accent decor type metum ordin flag cancel white head ongo share content return halt view lock receiv viewer file proce valu unknown filter current intu sourc task prefer base filenam notif channel provid binder execut super sticki broadcast updat context activ string datum constant listen con overrid foreground util normal extra fig progress drawabl destroy handler thi true mode name builder servic encrypt packag parcel public applic"
"com.amaze.filemanager.shadows.jcifs.smb.ShadowSmbFile","Implementation public void constructor Ntlm Password Authentication auth File file this Input Stream throws Exception return long length ","length file implement throw constructor void authent thi stream auto input return except password public antl"
"com.amaze.filemanager.test.ShadowCryptUtil","Method handles encryption plain text various Implementation public static String Password Context context Text throws General Security Exception return Encrypt decryption cipher Decrypt ","implement context method throw except plain handl string cipher encrypt return static text password public decrypt secur variou"
"com.amaze.filemanager.test.ShadowShellInteractive","Implementation public boolean Running return true wait Idle void Command String command code Shell Result Listener throws Exception Interrupted Process Builder environment LANG TIME STYLE long process start exit Value Buffered Reader reader Input Stream result Array line while Line null ","implement string time stream listen exit environ void style command line throw proce null boolean valu code except ang wait true result interrupt reader builder array buffer start idl return input shell public run"
"com.amaze.filemanager.test.ShadowCryptUtilTest","Test public void test Encrypt Decrypt throws General Security Exception String text encrypted Crypt Util Password Runtime Environment application assert Equals decrypt With Utils Handler utils Create Writable Database fingerprint Client Path Necessary null Host ","databas client string writabl password creat util environ void throw null test equal fingerprint except path crypt runtim handler host decrypt encrypt assert text public secur applic"
"com.amaze.filemanager.utils.SmbStreamer.StreamSourceTest","Before public void throws Exception String Builder text File append Bytes file create Stream Source length Purpose Open existing Input Expected read buff Test open Existing byte assert Equals Read content equal buffer size from temp Arrays copy Range with bigger than Exceed Throw exception when reading happen closed thrown expected class Closed certain positions start Position Start writing exceed Index Bounds move incorrect wrong Illegal Argument after successful unavailable catch ignored MIME type return Mime Type name Name remain amount Exact Move beginning reset object ","length rang unavail object thrown string append amount begin stream wrong exact argument reset success creat index void mime file catch throw move test equal copi remain except sourc bound exceed type write size purpos temp exist posit name builder array close buffer read start ignor incorrect content buff input assert cla illeg return text byte public happen bigger expect"
"com.amaze.filemanager.utils.SmbStreamer.StreamSource","public Stream Source File file long super mime Mime Type Extension From Name name this notice strange input stream made some modifications original jcifs library needs streaming required returning renamed However needed specify buffer size constructor looks like Input read Buffer open Flags throws Exception Malformed Unknown Host RDONLY FFFF access type TYPE NAMED PIPE ATTR NORMAL CREAT TRUNC else connect Size length Setting properties didn work created libs folder there modified want stock have somehow equal with http server which void skip catch Override byte bytes start offs move position Illegal Argument Position bounds close print Stack Trace String ","length folder malform extens crest trace string somehow stream argument overrid server trunk creat normal void mime strang file origin pipe throw tart constructor requir catch stock move equal unknown except lib print sourc bound jiff type host els size acc skip thi librari set modif posit specifi name flag connect close buffer read properti start look notic super input return illeg stack byte public modifi renam"
"com.amaze.filemanager.utils.SmbStreamer.StreamServer","Override this customize server default delegates File allows directory listing param Percent decoded without parameters example index method POST parms Parsed percent from case data header Header entries return HTTP response class Response details public abstract String Properties files Starts given port Throws Exception socket already Stream Server wwwroot throws Stops void stop Socket close Thread join catch Interrupted ","method post percent string datum stream directori overrid server stop header void file entri catch throw custom para socket paramet detail except pars arrowroot allow respons thi exampl list default interrupt port pram close thread join properti start cla return abstract deleg index public decod"
"com.amaze.filemanager.utils.SmbStreamer.Streamer","public static Streamer Instance instance null PORT catch Exception print Stack Trace return boolean Media File file pattern matcher Name matches void long this length Override stop super Response serve String method Properties header parms files source name From Path equals HTTP NOTFOUND MIME PLAINTEXT else start range Property starts With bytes substring minus index Long parse Number Format Cloud Util Request from final Source RANGE SATISFIABLE Header Content Range data move Skipped PARTIALCONTENT Mime Type reset Length Accept Ranges ","length rang match satisfi accept serv method partial medium trace string datum reset request overrid static stop util header void index instanc mime file catch null format move boolean equal matcher streamer except pars print path sourc minu respons els final type skip thi plain found name cloud pattern port pram properti start content return super stack text byte public substr"
"com.amaze.filemanager.utils.UtilsTest","Test public void test Sanitize Input assert Equals sanitize apple ","sanit test appl equal assert input public void"
"com.amaze.filemanager.utils.ComputerParcelableTest","Purpose check computer Parcelable object equal Input equals Computer Object Expected result true Test public void test Equals assert True when name same confirm that different only addr false Name False address Addr ","object purpos test confirm equal name assert comput input expect result parcel true public add check addr fals void abl"
"com.amaze.filemanager.utils.BookSorterTest","Purpose when title length bigger than result positive Input compare Expected return integer Test public void test Compare Title Path Bigger String Amaze File Manager assert That book Sorter greater Than smaller negative less same path Same this case expected real failure name exist zero Equals Case difference ","length book string compar neg failur differ void manag file test equal real titl path purpos thi exist integ posit result amaz name sorter zero assert input return public bigger expect"
"com.amaze.filemanager.utils.Billing","public Billing Basic Activity activity this List Array donations layout Inflater Layout System Service Context LAYOUT INFLATER SERVICE billing Client Builder Listener build initiate Purchase Flow Override void Purchases Updated response Code Nullable purchases Recycler View Holder Create Group parent view Type root inflate adapter false return Donation Bind holder position Item Count size Details Params launch Cancel destroy Instance Starts connection Google Play services param execute Success private start Connection final Runnable State Setup Finished Response Class Simple Name finished code Connected true null Disconnected Ready ","inflat updat context setup client activ view listen overrid finish creat disconnect void parent instanc bill runnabl basic null count recycl para privat adapt purchas donat layout system code detail succ abl destroy respons type bind final size build thi holder true posit play list cancel initi name connect fals flow array builder oogl simpl item launch start readi root execut servic cla return public"
"com.amaze.filemanager.utils.ComputerParcelable","public Computer Parcelable String this name addr Override create From return Array size format describe Contents void write parcel boolean equals Object instanceof hash Code ","object string overrid creat void instanc hash format boolean equal code abl write size thi name array describ content comput add return parcel public"
"com.amaze.filemanager.utils.RootUtils","Copies file using root public static void copy String source destination throws Shell Running Exception mount Point File System Root Helper Command null Creates empty directory param path name mkdir touch Recursively removes with contents return boolean whether deleted Array List result size Moves Renames Path before rename after successful output This converts from booleans OCTAL permissions notations link Utils CHMOD COMMAND true false Octal READ WRITE EXECUTE ","use helper convert string link directori mod success static creat util void command file irk throw null move para mount boolean copi touch system except path sourc empti renam write size destin thi true permiss result list name fals delet array output remov read root execut notat content return recurs shell octal public run"
"com.amaze.filemanager.utils.FingerprintHandler","public Fingerprint Handler Context Intent intent Material Dialog material Encrypt Decrypt Utils Button Callback Interface decrypt context this Requires Build VERSION CODES void authenticate Manager manager Crypto Object crypto Cancellation Signal cancellation Activity Compat check Self Permission Manifest permission FINGERPRINT Package PERMISSION GRANTED return null Override Authentication Error Char Sequence String Help help Failed failed Succeeded Result result confirm ","error object context self materi activ string callback overrid fail util void version manag succeed dialog null requir char button signal code fingerprint grant check compact crypt handler sequenc build thi help intent permiss result cancel confirm decrypt manifest authent encrypt return packag public interfac"
"com.amaze.filemanager.utils.ImmutableEntry","public Immutable Entry Nullable value this Override final return Value throw Unsupported Operation Exception ","unsupport final entri immut throw oper null thi valu return overrid except public abl"
"com.amaze.filemanager.utils.ProgressHandler","Constructor start instance param source Files total number files selected user operation public Progress Handler long Size this when know size publish progress after calculating write length Position position byte being processed synchronized void Written Length speed written Listener Progressed Name String return Source Processed Total Cancelled boolean ","length user string listen void instanc file constructor para boolean calcul speed progress sourc handler write size written total thi posit cancel select name oper start synchron process return publish byte public"
"com.amaze.filemanager.utils.PreferenceUtils","public static Status Color String skin return darker parse ","darker string color return static skin public pars statu"
"com.amaze.filemanager.utils.GlideConstants","",""
"com.amaze.filemanager.utils.OnAsyncTaskFinished","",""
"com.amaze.filemanager.utils.LruBitmapCache","param Size caches that override link size this maximum number entries other sizes public Bitmap Cache super Default Override String return void bitmap ","maximum entri default size cach para thi string link super return overrid bitmap public void"
"com.amaze.filemanager.utils.BookSorter","Override public compare String result Ignore Case return ","ignor string return result overrid public compar"
"com.amaze.filemanager.utils.GenericFileProvider","",""
"com.amaze.filemanager.utils.AnimUtils","public static Interpolator Fast Slow Context context fast null Animation Utils load android interpolator slow return Animates filenames textview marquee after delay Make sure link Text View Selected boolean false order stop later void After Delay Millis Themed ","context anim view link fast static stop delay util void slow mill null boolean android filenam marque select theme fals interpol load return text public"
"com.amaze.filemanager.utils.ObtainableServiceBinder","public Obtainable Service Binder service this return ","obtain binder thi servic return public"
