"component","bagofwords","transformed_bagofwords"
"com.amaze.filemanager.ui.views.drawer.Drawer","public Drawer Main Activity main void refresh Result request Code response Intent intent Prefs null Data Build VERSION CODES KITKAT Content Resolver take Persistable Permission FLAG GRANT READ PERMISSION edit String Preferences Constants PREFERENCE DRAWER HEADER PATH commit Header Background close Locked boolean return Open Layout View open Closed pending fragment Transaction Path Hybrid File Mode UNKNOWN generate Simple Utils Fragment Current loadlist false else support Invalidate Options Menu Override Navigation Item Selected Null item Action Click title Title Metadata meta path switch Group case STORAGES GROUP equals General Dialog Creation show Properties Storage Root Helper Base true Theme break SERVERS CLOUDS FOLDERS contains Books rename Bookmark starts With Sftp Cloud Handler PREFIX DROPBOX GOOGLE DRIVE GDRIVE ONEDRIVE Something Phone Count phone final Image header Drawable drawer Parent Loader Listener Response Container Immediate Bitmap Resource drawable amaze Error Volley error catch Exception print Stack Trace select Correct Integer find Longest Containing deselect Everything Checked State Manager Color color Status reset Pending sync Toggle Configuration Changed Indicator Enabled Home Items size Does nothing tablets link Tablet param mode LOCK MODE LOCKED CLOSED OPEN UNDEFINED lock unlock UNLOCKED First first Second second ","folder correct phone break trace configur color reset imag catch switch resolv equal main code reselect grant except abl build hybrid loader intent pend sync background chang amaz statu immedi item read start bookmark navig load bitmap indic error action helper undefin server header void parent manag volley transact null para drive layout unlock pref final integ metum persist result flag simpl properti contain content return invalid renam fragment enabl book view lock menu request click home edit file dialog count commit toggl unknown support refresh current check print option prefer respons creation size base list select theme fals root tablet box prefix activ string datum link constant listen overrid util version gener boolean titl path drawabl handler els drop atinka drawer true permiss mode cloud resourc close oogl storag stack public"
"com.amaze.filemanager.ui.views.WarnableTextInputValidator","public Warnable Text Input Validator Context context Edit edit Layout View positive Button Validate validator Focus Change Listener this Changed Touch Enabled false warning Drawable drawable error Override void boolean state Return State STATE ERROR Motion Event event return perform Click block after Editable ","enabl error event context view listen overrid click edit motion void perform boolean touch layout warn drawabl abl block focu thi chang posit valid fals input return text public button"
"com.amaze.filemanager.ui.views.DisablableViewPager","public Disablable View Pager Context context Attribute attrs super this enabled true Override boolean Touch Event Motion event return Intercept void Paging Enabled ","intercept enabl attribut event pager disabl context view thi page boolean attar super true touch return overrid public motion void"
"com.amaze.filemanager.ui.views.RoundedImageView","public Rounded Image View Context Attribute attrs super background Color TRANSPARENT Anti Alias true Override void Background color Prevents vectors from getting bigger than their intended size MUST provide dimensions view relative smallest between width height Relative Size float throw Unsupported Operation Exception make image Accepted values this Bitmap Cropped bitmap radius final Width Height create Scaled false else output Config ARGB Canvas canvas Paint paint Rect rect Filter Dither Utils roundedimagepaint draw Circle Xfermode Porter Duff Mode return Converts link Drawable drawable drawn backed Hence conversion Icon instanceof null Intrinsic Bounds Illegal State Solid colors cannot represented images ","porter canva paint accept context model dither convert view link attar color height con overrid draw creat util void imag drawn grab alia instanc throw fig null prevent valu filter antu except transpar convers round bound drawabl henc final els size thi cert icon true mode background intend get provid fals dimens scale attribut unsupport output roundheadedn solid rel oper intrins crop radiu repres float super circl return illeg vector bitmap width public bigger duff"
"com.amaze.filemanager.ui.views.Indicator","public Indicator Context context this null Attribute attrs Style super final density Resources Display Metrics Typed Array obtain Styled Attributes styleable Diameter Dimension Pixel Size DEFAULT SIZE Radius half anim Duration long Integer animation ANIM DURATION Half selected Colour Color current Page SELECTED COLOUR unselected argb green blue recycle Paint ANTI ALIAS FLAG interpolator Anim Utils Fast Slow Interpolator combined Unselected Path Left Right rect Rect Attach State Change Listener void View Pager view Count Adapter register Data Observer Override Changed Current Immediate Scrolled position float Offset Pixels Attached Window fraction Position page Changing previous left Math Joining Fraction Selected else state true Detached From false ","window previou paint aim context pager anim fraction display combin left fast view attar color listen datum overrid durat math green util void style grab alia attach detach slow null count obtain recycl adapt blue antu current offset path abl final type els size thi cert integ true chang posit half select flag default fals densiti resourc attribut metric array dimens regist interpol diamet immedi join radiu page float super observ scroll pixel unselect public indic"
"com.amaze.filemanager.ui.views.CheckableCircleView","public Checkable Circle View Context context Nullable Attribute attrs super check Resources Drawable drawable white void Color color paint Anti Alias true invalidate Checked boolean checked this ","paint context view attar color void checkabl alia null boolean antu check drawabl abl thi true resourc attribut white circl super public invalid"
"com.amaze.filemanager.ui.views.ThemedImageView","public Themed Image View Context context this null Attribute attrs Style super Basic Activity equals DARK BLACK Color Filter argb else throw Illegal State Exception Could activity show correct icon color ","correct dark context view activ attar color imag style grab basic throw null equal filter except els thi icon black theme attribut super illeg public"
"com.amaze.filemanager.ui.views.ThemedImageButton","public Themed Image Button Context context super Attribute attrs Style Focusable true Override Char Sequence Accessibility Class Name return class ","style attribut access sequenc context char cla attar super true return focus overrid name public theme button imag"
"com.amaze.filemanager.ui.views.WarnableTextInputLayout","public Warnable Text Input Layout Context context Attribute attrs super Remove error warning void remove Error null Enabled false Override Nullable Char Sequence Style Warning true Appearance style input String ","error enabl context string attar overrid void style null char layout warn abl appear sequenc true fals attribut remov input super text public"
"com.amaze.filemanager.ui.views.FastScroller","public Fast Scroller Null Context context Attribute attribute super this scroll Listener initialise boolean Touch Event Motion motion Action handle Pressed true Visibility VISIBLE float relative Relative Position Handle manually Changing Recycler View null return else INVISIBLE false void register Color Filter State Drawable state drawable Compat fastscroller normal pressed PRESSED ENABLED STATE Inset Resources Dimension Pixel Size dimen track padding EMPTY Image recycler columns invalidate Hierarchy Change Override Child Added parent child Removed update Padding Left Right compute ","event enabl dime updat action press context view handl left fast child stroller manual listen color inset overrid motion void normal imag parent null recycl boolean pad touch filter column invis visibl compact drawabl track empti els size thi true chang posit initi fals steamrol resourc dimens attribut hierarchi regist rel remov float super return scroll pixel comput public invalid"
"com.amaze.filemanager.ui.views.CircleGradientDrawable","Constructor param color circular icon Theme current theme light dark which will determine boundary metrics convert width link Stroke method from public Circle Gradient Drawable String Display Metrics this Color parse Shape OVAL Size STROKE WIDTH equals DARK BLACK COLOR LIGHT ","dark method convert display string link color gradient constructor circular para equal oval boundari current pars drawabl shape size light thi icon black determin stroke theme metric circl width public"
"com.amaze.filemanager.ui.views.CircularColorsView","public Circular Colors View Context context super init Nullable Attribute attrs void Divider color divider Paint colors Flags ANTI ALIAS FLAG paint Initialized true ","attribut alia divid paint context circular null view color super attar true antu flag initi public intu void abl"
"com.amaze.filemanager.ui.views.ThemedTextView","public Themed Text View Context context Attribute attrs super Main Activity equals LIGHT Color Utils android color black else DARK BLACK white ","attribut els white dark context util light view activ equal black attar super main color text public theme android"
"com.amaze.filemanager.ui.views.DividerItemDecoration","public Divider Item Decoration Context context boolean showtopbottomdividers final Typed Array typed obtain Styled Attributes ATTRS Drawable recycle this left Padding Resources Display Metrics density right Override void Canvas Recycler View parent State state super return null draw Vertical Offsets Rect view Child Adapter Position Intrinsic Height ","canva context display view left child attar spectrophotometr height overrid draw void parent style divid null obtain recycl boolean pad adapt offset drawabl final decor type vertic thi cert posit array resourc attribut metric densiti item intrins super return public"
"com.amaze.filemanager.ui.views.ScrimInsetsRelativeLayout","public Scrim Insets Relative Layout Context context super init null Attribute attrs Style Override void draw Canvas canvas width Width height Height Foreground save translate Scroll Temp Rect Bounds bottom left right restore Count Allows calling container specify callback custom processing when insets change link System Windows called This useful setting padding elements based chrome Google List View When using with Grid remember clip Padding false Callback ","window scrim canva use context view left link attar height inset callback overrid foreground draw void style set custom null count clip pad translat layout system intu bound chrome allow rememb save temp cert thi base chang specifi list element fals attribut oogl rel grid contain super bottom scroll restor call process width public"
"com.amaze.filemanager.ui.views.preference.CheckBox","public Check Context context Attribute attrs super ","attribut context check attar super public"
"com.amaze.filemanager.ui.views.preference.SelectedColorsPreference","public Selected Colors Preference Context context Attribute attrs super void Visibility visibility this notify Changed Divider color background colors invalidate ","prefer attribut notifi divid context thi color attar super chang background select public visibl void invalid"
"com.amaze.filemanager.ui.views.preference.InvalidablePreferenceCategory","public Invalidable Preference Category Context context Attribute attrs super void invalidate Color accent title Utils Status notify Changed ","prefer attribut notifi context statu util categori attar super color titl chang public invalid accent void abl"
"com.amaze.filemanager.ui.views.preference.PathSwitchPreference","public Path Switch Preference Context context super Last Item Clicked return last ","prefer item context switch super return click public path"
"com.amaze.filemanager.ui.notifications.FtpNotification","Override public void Receive Context context Intent intent switch Action case Service ACTION STARTED create Notification Boolean Extra TILE false break STOPPED remove ","action extra context stop tile start switch break remov servic notif intent boolean overrid public creat receiv fals void"
"com.amaze.filemanager.ui.notifications.NotificationConstants","This creates channel applies correct metadata notification public static void Metadata Context context Notification Compat Builder type VERSION CODES switch case TYPE NORMAL Normal Channel break default throw Illegal Argument Exception Unrecognized else LOLLIPOP Category CATEGORY SERVICE JELLY BEAN Priority PRIORITY Visibility VISIBILITY PUBLIC ","correct context break datum argument static creat normal version void lollipop jelli throw switch code except visibl appli compact els type thi categori notif metum default channel builder unrecogn prioriti servic illeg public bean"
"com.amaze.filemanager.database.models.Sort","public Sort String path type this ","type sort thi string public path"
"com.amaze.filemanager.database.models.OperationData","Constructor types link Operation HIDDEN HISTORY LIST GRID public Data String path throw Illegal Argument Exception Wrong constructor object this name null host Name BOOKMARKS SFTP param when used Utils Handler remove From Database Override Builder append Text Empty redacted return ","object databas string link datum append wrong argument overrid util throw constructor null para hidden except path handler empti type host thi histori list name builder oper grid remov bookmark return redact illeg text public"
"com.amaze.filemanager.database.models.EncryptedEntry","public Encrypted Entry String path password this void return Path Password ","entri thi string encrypt return password public path void"
"com.amaze.filemanager.database.models.CloudEntry","public Cloud Entry Open Mode service Type String persist Data this void return Persist type Support values from link amaze filemanager utils Service open Returns ordinal ","manag type entri file util thi string datum servic link persist return mode valu ordin amaz support public cloud void"
"com.amaze.filemanager.database.models.Tab","public String path home this Number Original Path boolean save Paths Shared Preferences shared File Utils Accessible return else ","origin prefer file access els save thi string boolean share return home public util path"
"com.amaze.filemanager.asynchronous.asynctasks.LoadFilesListTask","public Load Files List Task Context String path Main Fragment Open Mode openmode boolean show Thumbs Hidden Async Finished Pair Array Layout Element Parcelable this listener ","fragment pair context string listen finish file boolean main layout hidden path abl task thi thumb mode sync list element array load parcel public"
"com.amaze.filemanager.asynchronous.asynctasks.LoadFolderSpaceDataTask","public Load Folder Space Data Task Context Theme Chart chart Hybrid File Parcelable context this file LEGENDS String string size used others free COLORS Color color piechart blue green ","folder context free string datum color green file blue space abl task size hybrid thi pie theme chart load parcel public legend"
"com.amaze.filemanager.asynchronous.asynctasks.SearchAsyncTask","public Search Async Task Activity Worker Fragment Helper Callbacks String input Open Mode open boolean root regex matches activity Weak Reference Input Root Regex Enabled Matches Override void Post Execute Void null Progress Update Hybrid File Parcelable Cancelled ","fragment enabl match updat post helper activ string worker callback weak overrid reg void search file null boolean progress abl task hybrid refer sync mode cancel root execut input parcel public"
"com.amaze.filemanager.asynchronous.asynctasks.WriteFileAbstraction","public Write File Abstraction Context context Content Resolver content Editable file String data Save cached boolean Root Explorer Async Task Finished Integer this Weak Reference ","context string datum weak finish edit explor file cach resolv boolean task write save thi integ refer sync root content abstract public"
"com.amaze.filemanager.asynchronous.asynctasks.SearchTextTask","public Search Text Task Editor Activity text this ","task activ thi editor text public search"
"com.amaze.filemanager.asynchronous.asynctasks.DeleteTask","public Delete Task Context this root Mode Preference Manager Default Shared Preferences Boolean Constants PREFERENCE ROOTMODE false Compressed Explorer Fragment compressed Override void Post Execute Deleted Intent intent Main Activity INTENT LOAD LIST String path files Parent Extra FILE send Broadcast Toast make Text Resources string error LENGTH SHORT show else null done clear Notification notification System Service NOTIFICATION SERVICE cancel COPY ","fragment error length compress context post activ string constant short overrid explor void parent manag file extra null boolean main copi system path task prefer els thi notif intent mode list send cancel default fals delet resourc root execut toast share servic load text public broadcast"
"com.amaze.filemanager.asynchronous.asynctasks.CloudLoaderAsyncTask","public Cloud Loader Async Task Main Activity main Handler cloud Cursor data this Weak Reference Utils Data Instance Override Null Boolean Background Void voids boolean Updated Drawer false null return Count move First Cancelled cancel true switch case Rail String catch Exception print Stack Trace final Config toast string failed else break Entry Gdrive saved Google Drive Storage Application Context CLOUD AUTHENTICATOR REDIRECT Advanced Authentication find Open Mode GDRIVE load Persist Parse login update Account Plugin error plugin delete Connection authenticate connection Dropbox DROPBOX Onedrive ONEDRIVE default Toast make Text restart LENGTH LONG show while Next Post Execute result refresh ","length error updat context post activ string datum trace break restart con fail weak overrid util void instanc entri catch fig null count move switch boolean drive cursor advanc main account except refresh pars print task handler final els rail redirect drop save loader thi refer drawer true sync background mode persist cancel plug result default connect cloud fals delet oogl storag authent execut toast login return load stack box text public applic"
"com.amaze.filemanager.asynchronous.asynctasks.DbViewerTask","public Viewer Task Cursor schema content Fragment this string Builder String Settings Default Text Encoding Name ","fragment task viewer set default text thi string content cursor name schema public encod builder"
"com.amaze.filemanager.asynchronous.asynctasks.AsyncTaskResult","public Async Task Result result this exception null Throwable ","task throw null thi sync result except public abl"
"com.amaze.filemanager.asynchronous.asynctasks.CountItemsOrAndSizeTask","public Count Items Size Task Context Text View items Hybrid File Parcelable boolean storage this context file Storage ","task file item context size storag count view hybrid thi boolean parcel text public abl"
"com.amaze.filemanager.asynchronous.asynctasks.MoveFiles","public Move Files Array List Hybrid Parcelable files Main Fragment Context context Open Mode mode main this Override void Post Execute Boolean moved Correctly Maintains list filesystems supporting rename implementation Please update return your link type supported here static Hash Operation Supported System hash FILE DROPBOX GDRIVE ONEDRIVE ","fragment updat context implement post link overrid static void file hash pleas ymi move boolean drive main system support abl type drop maintain hybrid thi mode list array correctli oper execut return parcel box public renam"
"com.amaze.filemanager.asynchronous.asynctasks.PrepareCopyTask","public Prepare Copy Task Main Fragment String path Boolean move Activity boolean root Mode main this context open Override void Progress Update message Toast make Text LENGTH LONG show ","fragment messag length updat context activ string overrid void move boolean copi main progress path task thi mode root toast prepar text public"
"com.amaze.filemanager.asynchronous.asynctasks.ReadFileTask","public Read File Task Content Resolver content Editable Abstraction file cache boolean Root Explorer Async Finished Returned Values this external Cache ","task file read cach resolv root thi boolean content abstract sync finish return valu extern edit public explor"
"com.amaze.filemanager.asynchronous.asynctasks.GenerateHashesTask","public Generate Hashes Task Hybrid File Parcelable final Context View view this context file Text find Linear Layout properties dialog Override protected String Background Void params string error Sftp Client Utils execute Session Template Path session throws Exception Command format extract Remote From result read Fully Input Stream Byte Array close Exit Status return else null Directory Checksum catch print Stack Trace ","error context client view string trace stream remot directori linear exit overrid extract util void command file hash gener dialog throw null format para catch templat layout except print path abl task final els hybrid thi checksum background result statu protect array close properti read execut input return stack parcel text byte public session"
"com.amaze.filemanager.asynchronous.asynctasks.compress.GzipHelperTask","public Gzip Helper Task Context context String file Path relative boolean Back Async Finished Array List Compressed Object Parcelable super this Weak Reference ","compress object context helper string weak finish file boolean path abl task thi refer sync list array rel zip super parcel public"
"com.amaze.filemanager.asynchronous.asynctasks.compress.RarHelperTask","Async Task load file items param real File Directory location relative access inside public Helper String boolean Back Finished Array List Compressed Object Parcelable super Location ","compress object helper string directori finish file para boolean real insid abl task acc sync locat list array item rel load super parcel public"
"com.amaze.filemanager.asynchronous.asynctasks.compress.ZipHelperTask","Async Task load file items param real File Directory location relative access inside public Helper Context String boolean goback Finished Array List Compressed Object Parcelable super context Weak Reference Location parse ","compress object context helper string directori weak finish file para boolean real insid pars abl task acc refer sync locat list array item rel load super parcel public"
"com.amaze.filemanager.asynchronous.asynctasks.compress.CompressedHelperTask","",""
"com.amaze.filemanager.asynchronous.asynctasks.compress.TarHelperTask","public Helper Task String file Path relative boolean Back Async Finished Array List Compressed Object Parcelable super this ","array task file compress object rel helper thi string boolean super sync parcel list finish public path abl"
"com.amaze.filemanager.asynchronous.loaders.AppListLoader","public List Loader Context context sort super this package Manager Package Override Apps Data Pair load Background Application Info apps Installed Applications MATCH UNINSTALLED PACKAGES DISABLED UNTIL USED COMPONENTS null return Collections empty Array size object File source String label Label info Name catch Found Exception print Stack Trace Parcelable elem flags version Formatter format Size length last Modified first Sorter second path void deliver Result data Reset Release Resources Started Canceled ","length pair match instal object context trace string datum label reset overrid collect void version manag file catch null sort format except print path sourc abl empti disabl size releas pap loader thi formatt background result compon list name found flag cancel sorter elem array resourc start super load packag public return stack parcel deliv info modifi applic"
"com.amaze.filemanager.asynchronous.handlers.FileHandler","public File Handler Main Fragment main Recycler View list boolean Thumbs super Looper this Weak Reference Override void handle Message final null Activity return String path switch what case Custom Observer GOBACK Back break ITEM Hybrid file Created open Mode Current Path Elements List generate Layout DELETED size current desc Name equals remove default Visibility VISIBLE reload true results LIST else Adapter Items loadlist compute Scroll ","fragment messag view handl activ string break looper weak overrid creat void file gener custom null recycl switch disc boolean equal adapt main layout current visibl path handler final els size thi hybrid refer thumb true mode result list name element default delet item remov reload super return observ load comput scroll public"
"com.amaze.filemanager.fragments.PropertiesSheet","Override public void setup Dialog dialog style super root View inflate Context layout fragment sheet properties null Content Bundle Arguments File Parcelable FILE Permission String PERMISSION Root Boolean ROOT Toolbar find collapsing toolbar Layout Title string Collapsed Text Appearance collapsed appbar Expanded expanded Name view file name Type type Directory folder substring last Index Size size Formatter format Utils Path Location location Accessed accessed Date Modified modified Coordinator Params Parent Bottom Sheet Behavior Callback Nested Scroll nested Change Listener scroll Class Simple State STATE COLLAPSED Changed Null bottom HIDDEN dismiss Slide float slide Offset ","fragment folder inflat access setup context view string behavior slide collaps argument directori overrid callback listen util sheet void parent nest style dialog file expand null format para boolean titl coordin layout hidden offset path abl bundl tool appear type size bar formatt dismi permiss chang date locat name simpl properti root content cla super bottom scroll float parcel text index public substr modifi"
