"component","bagofwords","transformed_bagofwords"
"com.amaze.filemanager.database.UtilsHandlerTest","Before public void utils Handler Utils Instrumentation Registry Target Context Create Writable Database exec DELETE FROM sftp Test test Encode Encrypt perform word example ","handler context perform databas test word exec delet exampl writabl encrypt instrument encod public creat util target void registri"
"com.amaze.filemanager.database.SortHandler","public static Sort Type Context context String path Shared Preferences shared Manager Default final only This Floders PREFERENCE SORTBY ONLY THIS Hash boolean contains global Sortby Integer parse sortby return Handler find Entry null type super DATABASE NAME VERSION Override void Create Lite Database CREATE TABLE COLUMN PATH TEXT PRIMARY TYPE INTEGER exec Upgrade Version Text Utils Empty Content Values content Writable insert clear delete catch Number Format Exception print Stack Trace update Nullable query Select FROM WHERE Readable Cursor cursor Query move First close else List Entries entry Array Next while finally ","folder updat context databas trace string exec writabl overrid static creat util void version manag hash entri catch null sort format move boolean cursor valu column upgrad primari pars insert path except print abl handler prefer final type empti els tabl thi global integ list name select default readabl lite delet queri close array contain share content return super stack text public"
"com.amaze.filemanager.database.CloudHandler","public Cloud Handler Context context super DATABASE NAME null VERSION this Override void Create Lite Database String CREATE TABLE COLUMN INTEGER PRIMARY PATH TEXT HOME ENCRYPTED PASSWORD CLOUD PERSIST SERVICE exec Upgrade Version DROP EXISTS Entry cloud throws Plugin Exception Sheet Fragment Provider Available Content Values content Service Type ordinal Crypt Util encrypt Password Persist catch print Stack Trace Writable insert clear Open Mode service delete Number Format update find query Select FROM WHERE Readable Cursor cursor Query move First decrypt return close else List Entries entry Array Count continue while Next finally ","fragment updat context databas trace string exec writabl home overrid avail password creat util sheet void version entri catch throw null format move count cursor valu column upgrad primari except print path insert crypt handler els type final tabl drop thi exist integ persist ordin mode plug list name select readabl cloud lite provid delet queri decrypt close array continu servic content encrypt super return stack text public"
"com.amaze.filemanager.database.CloudContract","",""
"com.amaze.filemanager.database.CryptHandler","public Crypt Handler Context context super DATABASE NAME null VERSION this Override void Create Lite Database String CREATE TABLE ENCRYPTED COLUMN INTEGER PRIMARY PATH TEXT PASSWORD exec Upgrade Version DROP EXISTS Entry Encrypted encrypted throws General Security Exception Content Values content Path Util Password Writable insert clear path delete catch Number Format print Stack Trace update find query Select FROM WHERE Readable Cursor cursor Query move First decrypt close else return List Entries entry Array boolean Next while finally ","updat context databas trace string exec writabl overrid password creat util void version entri catch throw null format move boolean cursor valu column upgrad primari except insert path print crypt handler els final tabl drop thi exist integ list name select readabl decrypt lite delet queri close array content encrypt super return stack text public secur"
"com.amaze.filemanager.database.UtilsHandler","public Utils Handler Context context super DATABASE NAME null VERSION this Override void Create Lite Database exec query History Hidden List Grid Bookmarks Sftp Upgrade Version switch case String backup Table TEMP TABLE PREFIX HISTORY replace INSERT INTO SELECT FROM group path DROP ALTER RENAME HIDDEN LIST GRID BOOKMARKS SFTP default break save Operation operation remove From Common Environment External Storage Directory dirs DIRECTORY DCIM DOWNLOADS MOVIES MUSIC PICTURES File Name name host database Writable Content Values values COLUMN PATH HOST PUBKEY equals PRIVATE insert update connection Connection format Linked Readable Cursor cursor paths boolean Next First while push Column Index close return Concurrent Radix Tree Void Files Default Char Array Node Factory SINGLETON View Path Decrypted catch General Security Exception print Stack Trace Toast make Text string failed decrypt LENGTH LONG show continue retval Client Necessary ERROR Error decrypting else Host encrypt result Auth Private rename clear delete ","client backup break trace writabl directori node creat environ catch switch equal hidden except movi histori default lite replac bookmark push secur error databas music exec extern dim singleton void null format char privat cursor tabl auto result delet continu remov content return factori renam view fail file valu radix upgrad print temp tree list select connect readabl concurr array grid common super prefix length pictur updat context string link overrid util version boolean retriev column insert path deer download handler els host drop save thi key name pub alter decrypt queri close oper storag toast encrypt stack text index public"
"com.amaze.filemanager.database.TabHandler","public Handler Context context super DATABASE NAME null VERSION Writable Database Override void Create Lite String CREATE TABLE EXISTS COLUMN INTEGER PRIMARY PATH TEXT HOME ENCRYPTED PASSWORD CLOUD Cloud PERSIST SERVICE SORT Sort TYPE exec Upgrade Downgrade Version Content Values content Number path home this insert clear delete catch Format Exception print Stack Trace find query Select FROM WHERE Cursor cursor Query move First close else return List Tabs Array Readable boolean Next while ","context databas trace string exec writabl home overrid password creat void version catch null sort format move boolean cursor valu tab column upgrad primari insert except path print downgrad handler els type tabl thi exist integ persist list name select readabl cloud lite delet queri close array servic content encrypt super return stack text public"
"com.amaze.filemanager.asynchronous.asynctasks.ssh.PemToKeyPairTaskTest2","Test public void test Unencrypted Pair throws Interrupted Exception Encrypted Such Field Illegal Access ","pair throw acc test encrypt unencrypt field illeg except public interrupt void"
"com.amaze.filemanager.asynchronous.asynctasks.ssh.PemToKeyPairTaskTest","Test public void test Unencrypted Pair throws Interrupted Exception Encrypted Such Field Illegal Access ","pair throw acc test encrypt unencrypt field illeg except public interrupt void"
"com.amaze.filemanager.asynchronous.asynctasks.ssh.GetSshHostFingerprintTask","public Host Fingerprint Task Null String hostname port Async Result Callback Public callback this ","task host null thi string sync result callback fingerprint name public port"
"com.amaze.filemanager.asynchronous.asynctasks.ssh.PemToKeyPairTask","public Pair Task Null Input Stream File Async Result Callback callback throws Exception this Utils read Fully Byte Array String Content Bytes ","array task pair file throw null read thi string content stream input sync result callback except byte public util"
"com.amaze.filemanager.asynchronous.asynctasks.ssh.SshAuthenticationTask","Constructor param hostname required port must unsigned integer fingerprint username login password using authentication private link Pair based public Authentication Task Null String this Override protected Async Result Client Background Void voids final Custom Config Host Verifier Connect Timeout CONNECT TIMEOUT connect null equals Password return else Publickey Provider Private Type from catch User Exception Stack Trace Transport ","pair user use client trace string link con overrid password void catch custom constructor requir para null fig privat equal transport fingerprint except unsign task final els host type thi integ base timeout sync background result verifi key name connect protect provid port authent login return stack public"
"com.amaze.filemanager.asynchronous.services.ftp.FtpServiceStaticMethodsTest","test link Service Local Inet Address Context must return empty string Test public void Must Empty Connected Network Instrumentation Registry Target fail Please connect your device network this assert Null Host address returned Remember wifi when running real devices Enabled Wifi Hotspot enable hotspot Equals ","enabl context int string link wife fail void pleas ymi null test potshot equal real instrument addr registri empti host rememb thi connect network devic servic assert return local public target run"
"com.amaze.filemanager.asynchronous.services.ftp.FtpServiceEspressoTest","Before public void throws Reflective Operation Exception service create After shut Down Destroy Test test Service Preference Manager Default Shared Preferences edit Boolean PREFERENCE SECURE false commit Start Command Intent ACTION START FTPSERVER Extra STARTED TILE assert True Running wait Server Client login Verify With Upload Download Secure true ","action client server edit creat upload void manag command extra throw test preserv commit boolean except tile destroy download prefer wait intent true verifi reflect default fals oper shut start servic share assert login public secur run"
"com.amaze.filemanager.asynchronous.services.ftp.FtpTileService","Override public void Receive Context context Intent intent update Tile State Start Listening super Filter Action Service ACTION STARTED STOPPED register Receiver Stop unregister Click ","updat unregist action regist context tile start servic intent super listen filter overrid click public stop receiv void"
"com.amaze.filemanager.asynchronous.services.ftp.FtpReceiver","Override public void Receive Context context Intent intent Received Action service Service class Extras equals ACTION START FTPSERVER Running start else STOP stop catch Exception Failed Message ","messag els action extra context catch start preserv servic cla intent equal fail overrid except public stop receiv void run"
"com.amaze.filemanager.asynchronous.services.ftp.FtpService","Override public Start Command Intent intent flags start Started Tile Boolean Extra STARTED TILE false attempts while server Thread null sleep catch Interrupted Exception ignored else return STICKY this Binder void Shared Preferences preferences Manager Default Server Factory Connection Config connection Anonymous Login Enabled true create String username PREFERENCE USERNAME DEFAULT equals password Crypt Util decrypt Password Application Context PASSWORD Protected General Security print Stack Trace Toast make Text Resources string error LENGTH SHORT show edit Service apply Base User Name anonymous Home Directory PATH List Authority list Array Write Permission Authorities save Listener SECURE Store Instance load open KEYSTORE Algorithm init Trust trust Configuration Client WANT ftpserver Implicit Port Idle Timeout TIMEOUT default send Broadcast ACTION Package FAILEDTOSTART Destroy interrupt join Alive stop STOPPED Task Removed root super restart Class Pending FLAG SHOT Alarm alarm System ALARM SERVICE ELAPSED REALTIME Clock elapsed Realtime static boolean Running Connected Local Network context Connectivity CONNECTIVITY Info Active connected Type TYPE WIFI ETHERNET Interface Collections Interfaces Display starts With rndis Socket Wifi Hotspot enabled call Inet Address Enumeration netinterfaces More Elements next addresses Addresses ADDRESS Host Loopback Link value byte bytes Unknown which shift PORT ","user client faintheart trace display restart configur directori static creat stop instanc command catch equal except anonym crypt mealtim intent pend default port loop net start cla load aliv info secur error action wife server collect void manag null system type write flag thread remov alarm idl ignor login share return call factori sleep interfac store enabl home edit enumer keyston valu socket unknown addr tile print appli intu rind task prefer author base thernet list shot element interrupt connect fals attempt array elaps algorithm binder root super sticki local trust broadcast length address context int activ string link short listen con overrid password util clock extra fig preserv potshot boolean path destroy els host save thi implicit timeout true permiss name send decrypt protect resourc shift join network toast servic stack packag text byte public applic run"
"com.amaze.filemanager.utils.files.CryptUtilTest","public void context Instrumentation Registry Target Context Test test Encrypt Decrypt throws Exception String password hackme encrypted Crypt Util Password assert Equals decrypt ","context throw hackl util test string crypt equal encrypt instrument assert except password public decrypt target void registri"
"com.amaze.filemanager.utils.files.FileListSorterTest","Purpose when dirs file directory result Input File List Sorter compare Expected return Test public void test Layout Element Parcelable Amaze Manager user symlink true false Open Mode UNKNOWN assert Equals sort title length bigger than positive integer Title Bigger That greater Than smaller negative less same zero Same date more recent Date Lastest size Size extension Extension Another Number ","length user extens neg directori saltest void manag file sort test equal unknown expect titl layout abl deer size purpos integ true mode result posit list amaz element date sorter fals zero recent slinki assert input return parcel public bigger compar"
"com.amaze.filemanager.utils.files.CryptUtil","Constructor will start encryption process serially Make sure call with background thread result file same directory link CRYPT EXTENSION extension done encrypting password this database constructors decrypt files only service through Service Watcher Util initialize watchers beforehand param source File public Crypt Context context Hybrid Parcelable Progress Handler progress Array List failed String target Filename throws General Security Exception Mode Parent Decrypt specified path used open cache simply custom preference check user provided passwords from encrypted Path which decrypted parent normal case Directory Open FILE equals External Cache Method handles plain various static Password Text Build VERSION CODES return Encrypt else JELLY BEAN decryption cipher initializes Cipher android hardware fingerprint Fingerprint Manager null Instance ALGO Parameter Spec Bytes ENCRYPT MODE Secret Keygen keygen ","user extens context hardwar method databas string link handl extern directori fail password static util normal parent variou version manag instanc file jelli secret throw custom constructor serial proce para cach cipher equal null code progress beforehand except check fingerprint paramet path sourc crypt abl handler prefer els android build thi hybrid plain watcher filenam mode background result spec list specifi initi key gen decrypt provid array thread start ago servic simpli encrypt return call parcel text byte public secur target bean"
"com.amaze.filemanager.utils.files.GenericCopyUtil","public Generic Copy Util Context context Progress Handler progress this Method exposes class initiate copy param source File file which copied target void Hybrid Parcelable throws Exception Source Target start false ","context method expos util void file gener throw para copi progress except sourc abl handler thi hybrid initi fals start cla parcel public target"
"com.amaze.filemanager.utils.files.FileUtils","public static long folder Size File directory Progress Update Long update State length file list Files else null catch Exception print Stack Trace return Hybrid Simple Path Config Instance recursive code size slow stupid inaccurate because permission problems Only fallback when available Context Folder bytes Sftp SFTP Client client String remote retval Remote Resource Info info Directory Attributes Problem accessing finally Cloud Open Mode open Meta Data Utils data Storage cloud Account meta Children strip Helper method path context calculate files Total Bytes Array List Parcelable total Base Calls link scan using param void Null from Triggers media scanner multiple paths filesystem directly might present anymore move rename which lead java Found hybrid exists Local Media Scanner Connection store changed supported Document document false crossfade View buttons pathbar Alpha Visibility VISIBLE animate alpha Duration Listener Animator Adapter Override Animation animation GONE reveal Show view boolean Object animator Float ALPHA Start start Inverse share Async Task Void protected Background params create Share Link Post Execute super copy Clipboard Toast make Text string copied LENGTH LONG show execute Activity Theme skin uris true mime Mime Types equals float readable Install permissions needed Manifest REQUEST INSTALL PACKAGES install Permissions Amaze forcechooser even default user openunknown Intent Action ACTION VIEW type trim Content activity apply Flag Chooser openwith noappfound SHORT With Flags FLAG GRANT READ PERMISSION normalize Empty EMULATED STORAGE SOURCE TARGET EXTERNAL starts replace normalized Absolute VOLUME INTERNAL Method supports showing without extension determines there something current switch case DROPBOX GDRIVE ONEDRIVE Spaces free Usable android content Manager clipboard System Service CLIPBOARD SERVICE Plain Primary Names ends root split Paths substring while last Index Collections reverse Read Main Shared Preferences shared Prefs Boolean Constants PREFERENCE TEXTEDITOR NEWSTACK Handler Self Default studio Count Lower Case General Dialog Creation Package Compressed Extractable Archive intent Database Viewer class Icons AUDIO audio Down Timer Tick millis Until Finished cancel opening Support Concurrent Radix Tree Value Char Sequence Keys Starting UNKNOWN generate Linked parsing line returned stdout shell must command parse linked Builder array contains Colon Position append Parse Date Format simpledateformat yyyy Modified Line char write Storages Accessible pref Hidden SHOW HIDDENFILES Parent Root ROOTMODE PREFIX storage Converts Checks whether bookmark empty created check Explorer lost Operations mkdir Error launch done invalid ","folder access user client free trace append lead cro remot directori editor scan skin static creat forc instanc line command ivvyy catch slow directli move switch equal copi chooser code main trigger except invers grant visibl space hidden abl stout hybrid exist plain icon intent chang sync background found amaz lower posit default date attribut replac read start emul anymor bookmark cla shell info substr target split error instal use gone action extens volum self helper stupid medium databas tick colon extern trim ava collect finish explor void parent archiv manag null document para char format adapt drive system pars pref android empti final type sequenc write intern metum scanner determin audio flag cancel strip simpl manifest contain share content return call invalid modifi store renam clipboard timer anim post convert view request durat avail viewer mime file dialog count lost calcul unknown radix valu account support alpha current primari print appli sourc studio check task prefer creation absolut size multipl fade revers base tree list connect theme fals readabl concurr array launch reveal execut root float super local box button prefix length updat object compress context method activ string datum child link short usabl listen con callback overrid profound constant extract util index normal gener mill fig irk boolean retriev progress path handler els deform bar total drop true permiss mode inaccur key name cloud protect builder resourc storag oper toast servic recurs stack packag parcel text byte public"
"com.amaze.filemanager.utils.files.EncryptDecryptUtils","Queries database path password Starts encryption process after query param file plaintext throws General Security Exception Errors encrypting folder errors public static void start Encryption Context final String Intent intent Crypt Handler dest Path substring last Index concat Extra Service ENCRYPT TARGET Encrypted Entry encrypted Watcher Util decrypt File Main Activity main Fragment Open Mode open Hybrid Parcelable source Utilities Provider utils boolean broadcast Result Decrypt class OPEN MODE ordinal SOURCE DECRYPT PATH Shared Preferences preferences Manager Default find catch print Stack Trace Toast make Text decryption fail LENGTH LONG show return Button Callback Interface Override confirm failed null switch Password case Constants PASSWORD FINGERPRINT Build VERSION CODES Dialog Creation Fingerprint Theme else Illegal State break MASTER PREFERENCE DEFAULT default ","folder error fragment broadcast length context interfac databas activ string trace break constant fail callback overrid password static util void version manag file extra entri throw catch proce null para switch button boolean main code fingerprint except master print path conceit crypt abl handler sourc final prefer dialog creation els build plain hybrid intent watcher mode ordin result confirm default decrypt theme provid queri start fest toast servic cla encrypt share return stack illeg parcel text index public substr secur target"
"com.amaze.filemanager.utils.files.FileListSorter","public File List Sorter sort this dirs Compares elements return negative zero positive integer first argument less than equal greater second Override compare Layout Element Parcelable file Directory else title Ignore Case Long value date long Size final String Extension ","extens string neg directori argument overrid file sort equal titl valu layout abl deer els final size thi integ posit date list element sorter zero ignor return parcel public compar"
"com.amaze.filemanager.filesystem.HybridFileParcelableTest","Before public void file Path Hybrid File Parcelable storage sdcard Test directory true false Purpose name Input Expected return Name assert Equals Change changed Tset open mode Open Mode FILE files directories this class have link empty string Link creation date Date size Size Check whether Directory type path permissions Permission null Write object into parcel send through intent read from write sent extracted obtain describe Contents Data Position created From CREATOR ","object string link datum directori extract creat void file sent null test obtain equal stet check path abl empti creation card type size purpos write hybrid thi intent true chang mode date permiss posit name send fals storag read describ cla assert input return content creator parcel public expect"
"com.amaze.filemanager.filesystem.RootHelperTest","Before public void throws Exception sysroot mkdir String File subdir Files create Symbolic Link Paths Environment External Storage Directory Absolute Output Stream write close symlink Test test Root Interrupted Verify false Security Illegal Argument Main Activity shell Interactive Shell Builder open true ","subduer activ string link stream extern directori argument creat environ void file irk throw test main except path absolut write true verifi interrupt fals builder output close slinki storag root symbol illeg shell public secur interact"
"com.amaze.filemanager.filesystem.Operations","public static void mkdir Null final Hybrid File file Context context boolean root Mode Error Call Back error Async Task Void private Data Utils data Instance Override protected Background params Main Activity Helper Directory Recursive Operations Name Valid invalid return null exists Sftp mkdirs catch Exception print Stack Trace done false else Document directory Create Path parent Parent create true Drop Cloud Storage cloud Dropbox Account Open DROPBOX Folder strip Drive ONEDRIVE Google Gdrive GDRIVE Local Root mode check launch ROOT Shell Running execute Executor THREAD POOL EXECUTOR mkfile Output Stream close byte temp Bytes Array Input upload substring last Index rename Malformed Client Template SFTP client extract Remote From move switch case FILE break Post Execute super hybrid Files scan Well wouldn want copy when target inside source otherwise into loop possible Copy Loop Possible Parcelable contains Validates special reserved characters shall allowed names filesystems filename full path String ASTERISK BACKWARD SLASH COLON FOREWARD GREATER THAN LESS QUESTION MARK QUOTE ","folder client trace break stream remot directori scan static creat mark instanc catch midair move switch makefil main copi except charact abl allow hybrid exist sync background loop reserv byte shell substr target error helper colon void parent null document para privat drive templat system insid executor final valid strip thread contain return call invalid renam post backward question file account check print sourc task forward temp filenam otherwis slash asterisk fals output array launch root execut input local super box malform context activ string datum overrid extract upload util special irk boolean path pool els drop true mode name cloud protect close oogl oper storag quot recurs stack parcel index public run"
"com.amaze.filemanager.filesystem.CustomFileObserver","public Custom File Observer String path Handler handler super MASK this boolean Stopped return Path Override void start Watching Build VERSION CODES Polling System else stop true Event event IGNORED long delta Time Calendar Instance Millis last Messaged switch case CREATE MOVED paths Added break DELETE FROM Removed SELF obtain GOBACK send Target DEFER CONSTANT Timer schedule Task messaging Scheduled Messages ","event messag timer self break string time constant mask overrid stop creat void version instanc schedul file mill custom move switch obtain boolean code system path handler task els build thi true send poll delet watch deltum calendar remov start ignor defer observ super return public target"
